{
  "format": "fpvs-loreta-source-payload-v1",
  "label": "Example occipital source map",
  "kind": "volume_mesh",
  "coordinate_space": "normalized_display",
  "source_model": "example_prepared_volume_grid",
  "value_label": "synthetic activation amplitude",
  "points": [
    [-0.36, -0.58, 0.12],
    [-0.20, -0.58, 0.12],
    [-0.28, -0.72, 0.12],
    [-0.28, -0.58, 0.26],
    [-0.28, -0.58, -0.02],
    [-0.28, -0.44, 0.12],
    [0.20, -0.58, 0.12],
    [0.36, -0.58, 0.12],
    [0.28, -0.72, 0.12],
    [0.28, -0.58, 0.26],
    [0.28, -0.58, -0.02],
    [0.28, -0.44, 0.12]
  ],
  "values": [0.42, 0.58, 0.93, 1.0, 0.55, 0.72, 0.50, 0.63, 0.96, 0.88, 0.46, 0.77],
  "faces": [
    [0, 2, 3],
    [2, 1, 3],
    [1, 5, 3],
    [5, 0, 3],
    [2, 0, 4],
    [1, 2, 4],
    [5, 1, 4],
    [0, 5, 4],
    [6, 8, 9],
    [8, 7, 9],
    [7, 11, 9],
    [11, 6, 9],
    [8, 6, 10],
    [7, 8, 10],
    [11, 7, 10],
    [6, 11, 10]
  ],
  "metadata": {
    "synthetic": true,
    "example_only": true,
    "intended_use": "prepared source-map payload format fixture",
    "calculation_status": "not computed from EEG",
    "region_hint": "bilateral occipital"
  }
}
