{
  "format": "fpvs-loreta-source-payload-v1",
  "label": "Example fsaverage-native source map",
  "kind": "volume_mesh",
  "coordinate_space": "fsaverage_surface",
  "source_model": "example_fsaverage_volume_grid",
  "value_label": "synthetic activation amplitude",
  "points": [
    [-32.0, -74.0, 12.0],
    [-18.0, -74.0, 12.0],
    [-25.0, -88.0, 12.0],
    [-25.0, -74.0, 25.0],
    [-25.0, -74.0, -2.0],
    [-25.0, -60.0, 12.0],
    [18.0, -74.0, 12.0],
    [32.0, -74.0, 12.0],
    [25.0, -88.0, 12.0],
    [25.0, -74.0, 25.0],
    [25.0, -74.0, -2.0],
    [25.0, -60.0, 12.0]
  ],
  "values": [0.48, 0.60, 0.91, 1.0, 0.52, 0.69, 0.44, 0.62, 0.96, 0.86, 0.50, 0.74],
  "faces": [
    [0, 2, 3],
    [2, 1, 3],
    [1, 5, 3],
    [5, 0, 3],
    [2, 0, 4],
    [1, 2, 4],
    [5, 1, 4],
    [0, 5, 4],
    [6, 8, 9],
    [8, 7, 9],
    [7, 11, 9],
    [11, 6, 9],
    [8, 6, 10],
    [7, 8, 10],
    [11, 7, 10],
    [6, 11, 10]
  ],
  "metadata": {
    "synthetic": true,
    "example_only": true,
    "intended_use": "future calculation output shape in fsaverage coordinates",
    "calculation_status": "not computed from EEG",
    "coordinate_note": "points are toy fsaverage-like millimeter coordinates"
  }
}
